<?xml version="1.0" encoding="UTF-8"?>

<xs:schema xmlns:xs="http://www.w3.org/2001/XMLSchema">
    <xs:element name="supportTicket">
        <xs:complexType>
            <xs:sequence>
                <xs:element name="ticket" minOccurs="0" maxOccurs="unbounded">
                    <xs:complexType>
                        <xs:sequence>
                            <xs:element name="subject" type="xs:string" />
                            <xs:element name="issueDate" type="xs:dateTime" />
                            <xs:element name="messages">
                                <xs:complexType>
                                    <xs:sequence>
                                        <xs:element name="message" minOccurs="1" maxOccurs="unbounded">
                                            <xs:complexType>
                                                <xs:sequence>
                                                    <xs:element name="messageText" type="xs:string" />
                                                    <xs:element name="messageDate" type="xs:dateTime" />
                                                </xs:sequence>
                                                <xs:attribute name="userId" type="xs:positiveInteger" use="required" />
                                            </xs:complexType>
                                        </xs:element>
                                    </xs:sequence>
                                </xs:complexType>
                            </xs:element>
                        </xs:sequence>
                        <xs:attribute name="userId" type="xs:positiveInteger" use="required" />
                        <xs:attribute name="ticketId" type="xs:positiveInteger" use="required" />
                        <xs:attribute name="status" type="xs:string" use="required" />
                    </xs:complexType>
                </xs:element>
            </xs:sequence>
        </xs:complexType>
    </xs:element>
</xs:schema>